first_name,last_name,domain_name,lead_id,company_name,contact_name,contact_email,lead_status,source,assigned_to,notes
Yalonda,Glavias,myspace.com,84,Shuffledrive,Yalonda Glavias,yalonda.glavias@myspace.com,Lost,Event,1045,"Sed sagittis. Nam congue, risus semper porta volutpat, quam pede lobortis ligula, sit amet eleifend pede libero quis orci. Nullam molestie nibh in lectus. Pellentesque at nulla. Suspendisse potenti. Cras in purus eu magna vulputate luctus. Cum sociis natoque penatibus et magnis dis parturient montes, nascetur ridiculus mus. Vivamus vestibulum sagittis sapien. Cum sociis natoque penatibus et magnis dis parturient montes, nascetur ridiculus mus. Etiam vel augue."
Vic,Pulver,sbwire.com,85,Topicblab,Vic Pulver,vic.pulver@sbwire.com,Lost,Email Campaign,1023,"Nullam orci pede, venenatis non, sodales sed, tincidunt eu, felis. Fusce posuere felis sed lacus. Morbi sem mauris, laoreet ut, rhoncus aliquet, pulvinar sed, nisl. Nunc rhoncus dui vel sem. Sed sagittis."
Prissie,Cadd,hugedomains.com,86,Rhynoodle,Prissie Cadd,prissie.cadd@hugedomains.com,Lost,Referral,1016,Aenean fermentum. Donec ut mauris eget massa tempor convallis.
Eddi,O'Carmody,pbs.org,87,Skidoo,Eddi O'Carmody,eddi.o'carmody@pbs.org,Won,Event,1033,Vestibulum sed magna at nunc commodo placerat. Praesent blandit. Nam nulla.
Terence,Antham,issuu.com,88,Tazzy,Terence Antham,terence.antham@issuu.com,Lost,LinkedIn,1043,Mauris sit amet eros.
Martica,Sarl,nasa.gov,89,Mydo,Martica Sarl,martica.sarl@nasa.gov,Contacted,LinkedIn,1005,Nulla justo. Aliquam quis turpis eget elit sodales scelerisque. Mauris sit amet eros. Suspendisse accumsan tortor quis turpis. Sed ante. Vivamus tortor. Duis mattis egestas metus. Aenean fermentum.
Florette,Fairlaw,wp.com,90,Gabtune,Florette Fairlaw,florette.fairlaw@wp.com,Lost,Web,1045,"Fusce lacus purus, aliquet at, feugiat non, pretium quis, lectus. Suspendisse potenti. In eleifend quam a odio. In hac habitasse platea dictumst. Maecenas ut massa quis augue luctus tincidunt. Nulla mollis molestie lorem."
Monroe,Sizzey,bluehost.com,91,Trunyx,Monroe Sizzey,monroe.sizzey@bluehost.com,Won,Web,1009,"Fusce congue, diam id ornare imperdiet, sapien urna pretium nisl, ut volutpat sapien arcu sed augue."
Ward,Beazer,craigslist.org,92,Topiclounge,Ward Beazer,ward.beazer@craigslist.org,Won,Event,1011,"Pellentesque ultrices mattis odio. Donec vitae nisi. Nam ultrices, libero non mattis pulvinar, nulla pede ullamcorper augue, a suscipit nulla elit ac nulla. Sed vel enim sit amet nunc viverra dapibus. Nulla suscipit ligula in lacus."
Lemmy,Alpes,ed.gov,93,Gigabox,Lemmy Alpes,lemmy.alpes@ed.gov,Contacted,Web,1050,Pellentesque at nulla.
Hewett,Daughtry,storify.com,94,Voolith,Hewett Daughtry,hewett.daughtry@storify.com,Lost,LinkedIn,1043,"Integer ac leo. Pellentesque ultrices mattis odio. Donec vitae nisi. Nam ultrices, libero non mattis pulvinar, nulla pede ullamcorper augue, a suscipit nulla elit ac nulla."
Zsa zsa,Sinclar,over-blog.com,95,Skimia,Zsa zsa Sinclar,zsa zsa.sinclar@over-blog.com,Won,LinkedIn,1017,"In tempor, turpis nec euismod scelerisque, quam turpis adipiscing lorem, vitae mattis nibh ligula nec sem."
Rolfe,Moreland,linkedin.com,96,Zoovu,Rolfe Moreland,rolfe.moreland@linkedin.com,Contacted,Event,1014,"Suspendisse ornare consequat lectus. In est risus, auctor sed, tristique in, tempus sit amet, sem. Fusce consequat. Nulla nisl. Nunc nisl. Duis bibendum, felis sed interdum venenatis, turpis enim blandit mi, in porttitor pede justo eu massa."
Stan,Thecham,bloomberg.com,97,Agivu,Stan Thecham,stan.thecham@bloomberg.com,Contacted,LinkedIn,1024,"Proin at turpis a pede posuere nonummy. Integer non velit. Donec diam neque, vestibulum eget, vulputate ut, ultrices vel, augue. Vestibulum ante ipsum primis in faucibus orci luctus et ultrices posuere cubilia Curae; Donec pharetra, magna vestibulum aliquet ultrices, erat tortor sollicitudin mi, sit amet lobortis sapien sapien non mi. Integer ac neque. Duis bibendum. Morbi non quam nec dui luctus rutrum. Nulla tellus."
Essa,Bogays,google.com,98,Linktype,Essa Bogays,essa.bogays@google.com,Won,LinkedIn,1020,"Nam ultrices, libero non mattis pulvinar, nulla pede ullamcorper augue, a suscipit nulla elit ac nulla. Sed vel enim sit amet nunc viverra dapibus. Nulla suscipit ligula in lacus. Curabitur at ipsum ac tellus semper interdum. Mauris ullamcorper purus sit amet nulla. Quisque arcu libero, rutrum ac, lobortis vel, dapibus at, diam. Nam tristique tortor eu pede."
Emelyne,Leipelt,yolasite.com,99,Quatz,Emelyne Leipelt,emelyne.leipelt@yolasite.com,New,LinkedIn,1015,"Cum sociis natoque penatibus et magnis dis parturient montes, nascetur ridiculus mus."
Elsy,Hinstock,discovery.com,100,Eayo,Elsy Hinstock,elsy.hinstock@discovery.com,New,Web,1010,"Cras pellentesque volutpat dui. Maecenas tristique, est et tempus semper, est quam pharetra magna, ac consequat metus sapien ut nunc."
Jameson,Hartly,senate.gov,101,Brightdog,Jameson Hartly,jameson.hartly@senate.gov,Won,Event,1033,"In sagittis dui vel nisl. Duis ac nibh. Fusce lacus purus, aliquet at, feugiat non, pretium quis, lectus. Suspendisse potenti. In eleifend quam a odio. In hac habitasse platea dictumst. Maecenas ut massa quis augue luctus tincidunt."
Aldridge,Talton,cbsnews.com,102,Skidoo,Aldridge Talton,aldridge.talton@cbsnews.com,Won,Web,1002,"Donec quis orci eget orci vehicula condimentum. Curabitur in libero ut massa volutpat convallis. Morbi odio odio, elementum eu, interdum eu, tincidunt in, leo. Maecenas pulvinar lobortis est."
Teodoro,Fowlie,berkeley.edu,103,Yodo,Teodoro Fowlie,teodoro.fowlie@berkeley.edu,New,Email Campaign,1041,"Duis mattis egestas metus. Aenean fermentum. Donec ut mauris eget massa tempor convallis. Nulla neque libero, convallis eget, eleifend luctus, ultricies eu, nibh. Quisque id justo sit amet sapien dignissim vestibulum. Vestibulum ante ipsum primis in faucibus orci luctus et ultrices posuere cubilia Curae; Nulla dapibus dolor vel est. Donec odio justo, sollicitudin ut, suscipit a, feugiat et, eros. Vestibulum ac est lacinia nisi venenatis tristique. Fusce congue, diam id ornare imperdiet, sapien urna pretium nisl, ut volutpat sapien arcu sed augue."
Britteny,Bonde,cafepress.com,104,Photobug,Britteny Bonde,britteny.bonde@cafepress.com,Won,Event,1037,"Nulla nisl. Nunc nisl. Duis bibendum, felis sed interdum venenatis, turpis enim blandit mi, in porttitor pede justo eu massa. Donec dapibus. Duis at velit eu est congue elementum. In hac habitasse platea dictumst."
Tabbie,Shipperbottom,flavors.me,105,Viva,Tabbie Shipperbottom,tabbie.shipperbottom@flavors.me,Won,Referral,1031,"Mauris enim leo, rhoncus sed, vestibulum sit amet, cursus id, turpis. Integer aliquet, massa id lobortis convallis, tortor risus dapibus augue, vel accumsan tellus nisi eu orci. Mauris lacinia sapien quis libero. Nullam sit amet turpis elementum ligula vehicula consequat. Morbi a ipsum. Integer a nibh. In quis justo."
Rodie,Lodford,redcross.org,106,Skiba,Rodie Lodford,rodie.lodford@redcross.org,Contacted,Event,1026,"Proin interdum mauris non ligula pellentesque ultrices. Phasellus id sapien in sapien iaculis congue. Vivamus metus arcu, adipiscing molestie, hendrerit at, vulputate vitae, nisl. Aenean lectus."
Max,Ardley,fotki.com,107,Eimbee,Max Ardley,max.ardley@fotki.com,New,LinkedIn,1050,"In quis justo. Maecenas rhoncus aliquam lacus. Morbi quis tortor id nulla ultrices aliquet. Maecenas leo odio, condimentum id, luctus nec, molestie sed, justo. Pellentesque viverra pede ac diam. Cras pellentesque volutpat dui."
Ashley,Baynton,slideshare.net,108,Thoughtstorm,Ashley Baynton,ashley.baynton@slideshare.net,Won,Referral,1043,"Aliquam augue quam, sollicitudin vitae, consectetuer eget, rutrum at, lorem. Integer tincidunt ante vel ipsum. Praesent blandit lacinia erat."
Gregory,Beamand,shop-pro.jp,109,Dynazzy,Gregory Beamand,gregory.beamand@shop-pro.jp,Won,Event,1018,"Donec diam neque, vestibulum eget, vulputate ut, ultrices vel, augue."
Cathe,Gosnoll,cam.ac.uk,110,Leexo,Cathe Gosnoll,cathe.gosnoll@cam.ac.uk,Lost,Referral,1021,"Quisque porta volutpat erat. Quisque erat eros, viverra eget, congue eget, semper rutrum, nulla. Nunc purus."
Curt,Mac Giany,java.com,111,Blognation,Curt Mac Giany,curt.mac giany@java.com,Contacted,Email Campaign,1012,"Donec diam neque, vestibulum eget, vulputate ut, ultrices vel, augue. Vestibulum ante ipsum primis in faucibus orci luctus et ultrices posuere cubilia Curae; Donec pharetra, magna vestibulum aliquet ultrices, erat tortor sollicitudin mi, sit amet lobortis sapien sapien non mi."
Rochester,Middle,scientificamerican.com,112,Tavu,Rochester Middle,rochester.middle@scientificamerican.com,New,LinkedIn,1024,"Donec vitae nisi. Nam ultrices, libero non mattis pulvinar, nulla pede ullamcorper augue, a suscipit nulla elit ac nulla. Sed vel enim sit amet nunc viverra dapibus. Nulla suscipit ligula in lacus."
Jerrine,McIntee,mail.ru,113,Livetube,Jerrine McIntee,jerrine.mcintee@mail.ru,Won,LinkedIn,1003,"Cras in purus eu magna vulputate luctus. Cum sociis natoque penatibus et magnis dis parturient montes, nascetur ridiculus mus. Vivamus vestibulum sagittis sapien. Cum sociis natoque penatibus et magnis dis parturient montes, nascetur ridiculus mus. Etiam vel augue. Vestibulum rutrum rutrum neque. Aenean auctor gravida sem. Praesent id massa id nisl venenatis lacinia. Aenean sit amet justo. Morbi ut odio."
Wenonah,Blackie,sohu.com,114,Linktype,Wenonah Blackie,wenonah.blackie@sohu.com,New,Email Campaign,1034,"In sagittis dui vel nisl. Duis ac nibh. Fusce lacus purus, aliquet at, feugiat non, pretium quis, lectus. Suspendisse potenti. In eleifend quam a odio."
Flemming,Mount,ucoz.ru,115,Ozu,Flemming Mount,flemming.mount@ucoz.ru,New,Referral,1030,"Nunc nisl. Duis bibendum, felis sed interdum venenatis, turpis enim blandit mi, in porttitor pede justo eu massa. Donec dapibus. Duis at velit eu est congue elementum. In hac habitasse platea dictumst. Morbi vestibulum, velit id pretium iaculis, diam erat fermentum justo, nec condimentum neque sapien placerat ante. Nulla justo. Aliquam quis turpis eget elit sodales scelerisque. Mauris sit amet eros."
Pavlov,Bamborough,google.fr,116,Innotype,Pavlov Bamborough,pavlov.bamborough@google.fr,Won,Email Campaign,1028,Praesent blandit. Nam nulla.
Darby,Looby,odnoklassniki.ru,117,LiveZ,Darby Looby,darby.looby@odnoklassniki.ru,New,Web,1029,"Vestibulum ante ipsum primis in faucibus orci luctus et ultrices posuere cubilia Curae; Nulla dapibus dolor vel est. Donec odio justo, sollicitudin ut, suscipit a, feugiat et, eros. Vestibulum ac est lacinia nisi venenatis tristique. Fusce congue, diam id ornare imperdiet, sapien urna pretium nisl, ut volutpat sapien arcu sed augue. Aliquam erat volutpat. In congue."
Ailbert,Weinberg,vkontakte.ru,118,Youopia,Ailbert Weinberg,ailbert.weinberg@vkontakte.ru,New,LinkedIn,1018,"Aenean lectus. Pellentesque eget nunc. Donec quis orci eget orci vehicula condimentum. Curabitur in libero ut massa volutpat convallis. Morbi odio odio, elementum eu, interdum eu, tincidunt in, leo. Maecenas pulvinar lobortis est. Phasellus sit amet erat. Nulla tempus. Vivamus in felis eu sapien cursus vestibulum. Proin eu mi."
Benetta,Robez,craigslist.org,119,Dazzlesphere,Benetta Robez,benetta.robez@craigslist.org,Contacted,Referral,1027,"Nulla facilisi. Cras non velit nec nisi vulputate nonummy. Maecenas tincidunt lacus at velit. Vivamus vel nulla eget eros elementum pellentesque. Quisque porta volutpat erat. Quisque erat eros, viverra eget, congue eget, semper rutrum, nulla. Nunc purus. Phasellus in felis. Donec semper sapien a libero."
Lilllie,Bleything,google.it,120,Quaxo,Lilllie Bleything,lilllie.bleything@google.it,Contacted,LinkedIn,1037,"Integer aliquet, massa id lobortis convallis, tortor risus dapibus augue, vel accumsan tellus nisi eu orci. Mauris lacinia sapien quis libero."
Tabbie,Battle,devhub.com,121,Riffpedia,Tabbie Battle,tabbie.battle@devhub.com,Lost,Email Campaign,1016,"Praesent blandit lacinia erat. Vestibulum sed magna at nunc commodo placerat. Praesent blandit. Nam nulla. Integer pede justo, lacinia eget, tincidunt eget, tempus vel, pede. Morbi porttitor lorem id ligula. Suspendisse ornare consequat lectus."
Enrico,Rochford,facebook.com,122,Jabberbean,Enrico Rochford,enrico.rochford@facebook.com,Won,Referral,1004,"Maecenas leo odio, condimentum id, luctus nec, molestie sed, justo."
Rosella,de Zamora,china.com.cn,123,Muxo,Rosella de Zamora,rosella.de zamora@china.com.cn,Lost,Event,1012,In hac habitasse platea dictumst. Maecenas ut massa quis augue luctus tincidunt.
Reg,Standage,xing.com,124,Devshare,Reg Standage,reg.standage@xing.com,Contacted,Event,1013,"Donec ut mauris eget massa tempor convallis. Nulla neque libero, convallis eget, eleifend luctus, ultricies eu, nibh."
Pate,Vasquez,tamu.edu,125,Tagtune,Pate Vasquez,pate.vasquez@tamu.edu,Contacted,Referral,1045,"Cum sociis natoque penatibus et magnis dis parturient montes, nascetur ridiculus mus. Etiam vel augue. Vestibulum rutrum rutrum neque. Aenean auctor gravida sem. Praesent id massa id nisl venenatis lacinia."
Sullivan,Semrad,ask.com,126,Shufflester,Sullivan Semrad,sullivan.semrad@ask.com,Won,Referral,1029,Etiam pretium iaculis justo. In hac habitasse platea dictumst. Etiam faucibus cursus urna. Ut tellus. Nulla ut erat id mauris vulputate elementum.
Traver,Dorsey,noaa.gov,127,Devify,Traver Dorsey,traver.dorsey@noaa.gov,Won,LinkedIn,1033,Maecenas ut massa quis augue luctus tincidunt. Nulla mollis molestie lorem.
Shaylah,Stanmer,jimdo.com,128,Agimba,Shaylah Stanmer,shaylah.stanmer@jimdo.com,New,Email Campaign,1028,Nulla mollis molestie lorem. Quisque ut erat. Curabitur gravida nisi at nibh.
Zilvia,Spires,g.co,129,Voonyx,Zilvia Spires,zilvia.spires@g.co,Lost,Event,1006,"Vestibulum ac est lacinia nisi venenatis tristique. Fusce congue, diam id ornare imperdiet, sapien urna pretium nisl, ut volutpat sapien arcu sed augue. Aliquam erat volutpat. In congue. Etiam justo. Etiam pretium iaculis justo. In hac habitasse platea dictumst. Etiam faucibus cursus urna. Ut tellus."
Julia,Drife,mozilla.org,130,Bluejam,Julia Drife,julia.drife@mozilla.org,Lost,Email Campaign,1017,Suspendisse accumsan tortor quis turpis. Sed ante. Vivamus tortor. Duis mattis egestas metus. Aenean fermentum.
Julius,Medland,mayoclinic.com,131,Eazzy,Julius Medland,julius.medland@mayoclinic.com,New,Email Campaign,1041,Morbi non lectus.
Sylvia,Herrema,paypal.com,132,Skynoodle,Sylvia Herrema,sylvia.herrema@paypal.com,Contacted,Event,1011,"Nunc rhoncus dui vel sem. Sed sagittis. Nam congue, risus semper porta volutpat, quam pede lobortis ligula, sit amet eleifend pede libero quis orci. Nullam molestie nibh in lectus. Pellentesque at nulla. Suspendisse potenti. Cras in purus eu magna vulputate luctus. Cum sociis natoque penatibus et magnis dis parturient montes, nascetur ridiculus mus. Vivamus vestibulum sagittis sapien. Cum sociis natoque penatibus et magnis dis parturient montes, nascetur ridiculus mus."
Bartolomeo,Labusch,hud.gov,133,Gabtune,Bartolomeo Labusch,bartolomeo.labusch@hud.gov,Lost,Event,1023,"Donec semper sapien a libero. Nam dui. Proin leo odio, porttitor id, consequat in, consequat ut, nulla. Sed accumsan felis."
Petey,Ruseworth,unesco.org,134,Divape,Petey Ruseworth,petey.ruseworth@unesco.org,New,Event,1027,Donec posuere metus vitae ipsum. Aliquam non mauris.
Melamie,Rohlf,sogou.com,135,Quire,Melamie Rohlf,melamie.rohlf@sogou.com,New,Event,1033,Sed accumsan felis. Ut at dolor quis odio consequat varius. Integer ac leo. Pellentesque ultrices mattis odio. Donec vitae nisi.
Rurik,Pre,smh.com.au,136,Rhynoodle,Rurik Pre,rurik.pre@smh.com.au,Won,Referral,1041,"Morbi a ipsum. Integer a nibh. In quis justo. Maecenas rhoncus aliquam lacus. Morbi quis tortor id nulla ultrices aliquet. Maecenas leo odio, condimentum id, luctus nec, molestie sed, justo. Pellentesque viverra pede ac diam."
Agnella,Spofforth,netvibes.com,137,Skilith,Agnella Spofforth,agnella.spofforth@netvibes.com,New,Web,1046,Pellentesque at nulla.
Helsa,Sharnock,cdbaby.com,138,Mymm,Helsa Sharnock,helsa.sharnock@cdbaby.com,Lost,LinkedIn,1041,"Fusce congue, diam id ornare imperdiet, sapien urna pretium nisl, ut volutpat sapien arcu sed augue. Aliquam erat volutpat. In congue. Etiam justo. Etiam pretium iaculis justo. In hac habitasse platea dictumst."
Isaak,Barrett,boston.com,139,Browsezoom,Isaak Barrett,isaak.barrett@boston.com,Contacted,Email Campaign,1028,Nullam varius. Nulla facilisi.
Estel,Joskovitch,toplist.cz,140,Vinte,Estel Joskovitch,estel.joskovitch@toplist.cz,Contacted,Event,1020,"Cras mi pede, malesuada in, imperdiet et, commodo vulputate, justo."
Dore,Rump,macromedia.com,141,Janyx,Dore Rump,dore.rump@macromedia.com,New,Event,1009,"Nulla tempus. Vivamus in felis eu sapien cursus vestibulum. Proin eu mi. Nulla ac enim. In tempor, turpis nec euismod scelerisque, quam turpis adipiscing lorem, vitae mattis nibh ligula nec sem. Duis aliquam convallis nunc. Proin at turpis a pede posuere nonummy."
Kingston,Copyn,telegraph.co.uk,142,Trilia,Kingston Copyn,kingston.copyn@telegraph.co.uk,Lost,Web,1003,"Nunc nisl. Duis bibendum, felis sed interdum venenatis, turpis enim blandit mi, in porttitor pede justo eu massa. Donec dapibus. Duis at velit eu est congue elementum. In hac habitasse platea dictumst."
Gale,Dawid,trellian.com,143,Jaxbean,Gale Dawid,gale.dawid@trellian.com,Contacted,Email Campaign,1030,"Nam ultrices, libero non mattis pulvinar, nulla pede ullamcorper augue, a suscipit nulla elit ac nulla. Sed vel enim sit amet nunc viverra dapibus. Nulla suscipit ligula in lacus. Curabitur at ipsum ac tellus semper interdum."
Corinne,Loads,e-recht24.de,144,Reallinks,Corinne Loads,corinne.loads@e-recht24.de,Contacted,Event,1004,In congue. Etiam justo.
Tucky,Shapter,indiegogo.com,145,Quatz,Tucky Shapter,tucky.shapter@indiegogo.com,Contacted,Referral,1001,"Pellentesque ultrices mattis odio. Donec vitae nisi. Nam ultrices, libero non mattis pulvinar, nulla pede ullamcorper augue, a suscipit nulla elit ac nulla. Sed vel enim sit amet nunc viverra dapibus. Nulla suscipit ligula in lacus. Curabitur at ipsum ac tellus semper interdum. Mauris ullamcorper purus sit amet nulla."
Amabelle,Jeromson,themeforest.net,146,Digitube,Amabelle Jeromson,amabelle.jeromson@themeforest.net,Won,LinkedIn,1003,"Aenean auctor gravida sem. Praesent id massa id nisl venenatis lacinia. Aenean sit amet justo. Morbi ut odio. Cras mi pede, malesuada in, imperdiet et, commodo vulputate, justo. In blandit ultrices enim. Lorem ipsum dolor sit amet, consectetuer adipiscing elit. Proin interdum mauris non ligula pellentesque ultrices. Phasellus id sapien in sapien iaculis congue."
Max,Garshore,squarespace.com,147,Skinix,Max Garshore,max.garshore@squarespace.com,New,Referral,1050,"Nam congue, risus semper porta volutpat, quam pede lobortis ligula, sit amet eleifend pede libero quis orci. Nullam molestie nibh in lectus. Pellentesque at nulla. Suspendisse potenti. Cras in purus eu magna vulputate luctus. Cum sociis natoque penatibus et magnis dis parturient montes, nascetur ridiculus mus. Vivamus vestibulum sagittis sapien."
Nickie,Pennicard,statcounter.com,148,Thoughtbridge,Nickie Pennicard,nickie.pennicard@statcounter.com,Contacted,Referral,1017,"Donec quis orci eget orci vehicula condimentum. Curabitur in libero ut massa volutpat convallis. Morbi odio odio, elementum eu, interdum eu, tincidunt in, leo. Maecenas pulvinar lobortis est."
Maisie,Climson,elpais.com,149,Meejo,Maisie Climson,maisie.climson@elpais.com,Contacted,Web,1030,"Duis ac nibh. Fusce lacus purus, aliquet at, feugiat non, pretium quis, lectus. Suspendisse potenti. In eleifend quam a odio. In hac habitasse platea dictumst. Maecenas ut massa quis augue luctus tincidunt."
Maybelle,Peacher,latimes.com,150,Eare,Maybelle Peacher,maybelle.peacher@latimes.com,New,LinkedIn,1008,"Curabitur gravida nisi at nibh. In hac habitasse platea dictumst. Aliquam augue quam, sollicitudin vitae, consectetuer eget, rutrum at, lorem. Integer tincidunt ante vel ipsum. Praesent blandit lacinia erat. Vestibulum sed magna at nunc commodo placerat."
Britt,Janikowski,umn.edu,151,Blogspan,Britt Janikowski,britt.janikowski@umn.edu,New,LinkedIn,1023,"Aenean fermentum. Donec ut mauris eget massa tempor convallis. Nulla neque libero, convallis eget, eleifend luctus, ultricies eu, nibh."
Davida,Crowhurst,seesaa.net,152,Riffpath,Davida Crowhurst,davida.crowhurst@seesaa.net,Won,LinkedIn,1006,Donec posuere metus vitae ipsum. Aliquam non mauris.
Idelle,Furmenger,independent.co.uk,153,Leenti,Idelle Furmenger,idelle.furmenger@independent.co.uk,New,Referral,1013,"Proin eu mi. Nulla ac enim. In tempor, turpis nec euismod scelerisque, quam turpis adipiscing lorem, vitae mattis nibh ligula nec sem. Duis aliquam convallis nunc. Proin at turpis a pede posuere nonummy. Integer non velit."
Jaquelyn,Agott,toplist.cz,154,Demivee,Jaquelyn Agott,jaquelyn.agott@toplist.cz,Lost,LinkedIn,1026,"In est risus, auctor sed, tristique in, tempus sit amet, sem. Fusce consequat. Nulla nisl. Nunc nisl. Duis bibendum, felis sed interdum venenatis, turpis enim blandit mi, in porttitor pede justo eu massa."
Scarlett,Aynold,narod.ru,155,Jabbersphere,Scarlett Aynold,scarlett.aynold@narod.ru,Lost,LinkedIn,1025,"Suspendisse accumsan tortor quis turpis. Sed ante. Vivamus tortor. Duis mattis egestas metus. Aenean fermentum. Donec ut mauris eget massa tempor convallis. Nulla neque libero, convallis eget, eleifend luctus, ultricies eu, nibh. Quisque id justo sit amet sapien dignissim vestibulum."
Clive,Tuther,1und1.de,156,Linktype,Clive Tuther,clive.tuther@1und1.de,Lost,Email Campaign,1050,"Lorem ipsum dolor sit amet, consectetuer adipiscing elit. Proin interdum mauris non ligula pellentesque ultrices."
Bobbe,Danko,nps.gov,157,Dablist,Bobbe Danko,bobbe.danko@nps.gov,New,Referral,1002,"Vestibulum ac est lacinia nisi venenatis tristique. Fusce congue, diam id ornare imperdiet, sapien urna pretium nisl, ut volutpat sapien arcu sed augue. Aliquam erat volutpat. In congue. Etiam justo. Etiam pretium iaculis justo."
Jeana,Ashburner,epa.gov,158,Realcube,Jeana Ashburner,jeana.ashburner@epa.gov,New,Web,1031,"Morbi ut odio. Cras mi pede, malesuada in, imperdiet et, commodo vulputate, justo."
Shoshanna,Danielian,seattletimes.com,159,Tekfly,Shoshanna Danielian,shoshanna.danielian@seattletimes.com,New,Email Campaign,1042,"Nam nulla. Integer pede justo, lacinia eget, tincidunt eget, tempus vel, pede. Morbi porttitor lorem id ligula. Suspendisse ornare consequat lectus."
Gabbie,Swinnerton,furl.net,160,Browsecat,Gabbie Swinnerton,gabbie.swinnerton@furl.net,Contacted,Referral,1016,"Integer ac leo. Pellentesque ultrices mattis odio. Donec vitae nisi. Nam ultrices, libero non mattis pulvinar, nulla pede ullamcorper augue, a suscipit nulla elit ac nulla. Sed vel enim sit amet nunc viverra dapibus."
Charley,Boullin,whitehouse.gov,161,Edgeblab,Charley Boullin,charley.boullin@whitehouse.gov,New,Email Campaign,1025,"In sagittis dui vel nisl. Duis ac nibh. Fusce lacus purus, aliquet at, feugiat non, pretium quis, lectus. Suspendisse potenti. In eleifend quam a odio. In hac habitasse platea dictumst. Maecenas ut massa quis augue luctus tincidunt. Nulla mollis molestie lorem. Quisque ut erat. Curabitur gravida nisi at nibh."
Moselle,Laws,google.fr,162,Livetube,Moselle Laws,moselle.laws@google.fr,Won,Event,1025,"Duis bibendum, felis sed interdum venenatis, turpis enim blandit mi, in porttitor pede justo eu massa. Donec dapibus. Duis at velit eu est congue elementum. In hac habitasse platea dictumst. Morbi vestibulum, velit id pretium iaculis, diam erat fermentum justo, nec condimentum neque sapien placerat ante. Nulla justo."
Jasen,Faulkes,slate.com,163,Gabspot,Jasen Faulkes,jasen.faulkes@slate.com,New,Email Campaign,1014,"Integer ac leo. Pellentesque ultrices mattis odio. Donec vitae nisi. Nam ultrices, libero non mattis pulvinar, nulla pede ullamcorper augue, a suscipit nulla elit ac nulla."
Issiah,Adrian,ustream.tv,164,Tazz,Issiah Adrian,issiah.adrian@ustream.tv,New,LinkedIn,1006,"Nam dui. Proin leo odio, porttitor id, consequat in, consequat ut, nulla. Sed accumsan felis. Ut at dolor quis odio consequat varius. Integer ac leo."
Patty,Bruckent,bigcartel.com,165,Jetwire,Patty Bruckent,patty.bruckent@bigcartel.com,Lost,Email Campaign,1010,Vivamus tortor. Duis mattis egestas metus.
Koral,Dalziell,ft.com,166,Browsetype,Koral Dalziell,koral.dalziell@ft.com,Lost,Web,1009,"Vestibulum sed magna at nunc commodo placerat. Praesent blandit. Nam nulla. Integer pede justo, lacinia eget, tincidunt eget, tempus vel, pede."
Chip,Haldene,soup.io,167,Oodoo,Chip Haldene,chip.haldene@soup.io,Lost,LinkedIn,1024,Ut tellus. Nulla ut erat id mauris vulputate elementum. Nullam varius. Nulla facilisi. Cras non velit nec nisi vulputate nonummy. Maecenas tincidunt lacus at velit. Vivamus vel nulla eget eros elementum pellentesque. Quisque porta volutpat erat.
Brunhilde,Kiddle,4shared.com,168,Fivechat,Brunhilde Kiddle,brunhilde.kiddle@4shared.com,Contacted,Web,1044,Aliquam erat volutpat. In congue. Etiam justo.
Joelle,Fossord,telegraph.co.uk,169,Voonder,Joelle Fossord,joelle.fossord@telegraph.co.uk,Contacted,Event,1034,"Integer ac leo. Pellentesque ultrices mattis odio. Donec vitae nisi. Nam ultrices, libero non mattis pulvinar, nulla pede ullamcorper augue, a suscipit nulla elit ac nulla. Sed vel enim sit amet nunc viverra dapibus. Nulla suscipit ligula in lacus. Curabitur at ipsum ac tellus semper interdum. Mauris ullamcorper purus sit amet nulla. Quisque arcu libero, rutrum ac, lobortis vel, dapibus at, diam."
Shae,Sapsforde,unicef.org,170,Kanoodle,Shae Sapsforde,shae.sapsforde@unicef.org,New,Event,1013,Cras in purus eu magna vulputate luctus.
