first_name,last_name,domain_name,lead_id,company_name,contact_name,contact_email,lead_status,source,assigned_to,notes
Taber,Hinrichs,amazon.de,1,Kimia,Taber Hinrichs,taber.hinrichs@amazon.de,Lost,Event,1009,"Pellentesque at nulla. Suspendisse potenti. Cras in purus eu magna vulputate luctus. Cum sociis natoque penatibus et magnis dis parturient montes, nascetur ridiculus mus. Vivamus vestibulum sagittis sapien. Cum sociis natoque penatibus et magnis dis parturient montes, nascetur ridiculus mus. Etiam vel augue. Vestibulum rutrum rutrum neque. Aenean auctor gravida sem. Praesent id massa id nisl venenatis lacinia."
Lenee,MacGahy,patch.com,2,Devshare,Lenee MacGahy,lenee.macgahy@patch.com,Won,Referral,1014,Aliquam sit amet diam in magna bibendum imperdiet.
Leon,Morson,dedecms.com,3,Demivee,Leon Morson,leon.morson@dedecms.com,Lost,Web,1044,"Aliquam augue quam, sollicitudin vitae, consectetuer eget, rutrum at, lorem. Integer tincidunt ante vel ipsum. Praesent blandit lacinia erat. Vestibulum sed magna at nunc commodo placerat."
Emelina,Gauvin,fotki.com,4,Edgeblab,Emelina Gauvin,emelina.gauvin@fotki.com,Lost,LinkedIn,1020,"Morbi vel lectus in quam fringilla rhoncus. Mauris enim leo, rhoncus sed, vestibulum sit amet, cursus id, turpis."
Penni,Bugdale,sohu.com,5,Photospace,Penni Bugdale,penni.bugdale@sohu.com,Won,Web,1042,"Integer aliquet, massa id lobortis convallis, tortor risus dapibus augue, vel accumsan tellus nisi eu orci."
Moses,Gerant,dailymail.co.uk,6,Fliptune,Moses Gerant,moses.gerant@dailymail.co.uk,Lost,Web,1032,"Proin leo odio, porttitor id, consequat in, consequat ut, nulla. Sed accumsan felis."
Gerome,Blant,weebly.com,7,Trilith,Gerome Blant,gerome.blant@weebly.com,New,LinkedIn,1031,"Nulla tempus. Vivamus in felis eu sapien cursus vestibulum. Proin eu mi. Nulla ac enim. In tempor, turpis nec euismod scelerisque, quam turpis adipiscing lorem, vitae mattis nibh ligula nec sem. Duis aliquam convallis nunc. Proin at turpis a pede posuere nonummy. Integer non velit. Donec diam neque, vestibulum eget, vulputate ut, ultrices vel, augue."
Wendie,Iveans,wiley.com,8,Livetube,Wendie Iveans,wendie.iveans@wiley.com,Contacted,Referral,1023,"Lorem ipsum dolor sit amet, consectetuer adipiscing elit. Proin interdum mauris non ligula pellentesque ultrices. Phasellus id sapien in sapien iaculis congue. Vivamus metus arcu, adipiscing molestie, hendrerit at, vulputate vitae, nisl. Aenean lectus. Pellentesque eget nunc. Donec quis orci eget orci vehicula condimentum. Curabitur in libero ut massa volutpat convallis. Morbi odio odio, elementum eu, interdum eu, tincidunt in, leo."
Barton,McConnachie,digg.com,9,Myworks,Barton McConnachie,barton.mcconnachie@digg.com,Contacted,Email Campaign,1030,"Maecenas tristique, est et tempus semper, est quam pharetra magna, ac consequat metus sapien ut nunc. Vestibulum ante ipsum primis in faucibus orci luctus et ultrices posuere cubilia Curae; Mauris viverra diam vitae quam. Suspendisse potenti. Nullam porttitor lacus at turpis. Donec posuere metus vitae ipsum."
Melosa,Micallef,businessinsider.com,10,Meemm,Melosa Micallef,melosa.micallef@businessinsider.com,Contacted,Email Campaign,1047,"Pellentesque ultrices mattis odio. Donec vitae nisi. Nam ultrices, libero non mattis pulvinar, nulla pede ullamcorper augue, a suscipit nulla elit ac nulla."
Brendan,De Ruel,deliciousdays.com,11,Thoughtbridge,Brendan De Ruel,brendan.de ruel@deliciousdays.com,Lost,Event,1039,"Nulla ac enim. In tempor, turpis nec euismod scelerisque, quam turpis adipiscing lorem, vitae mattis nibh ligula nec sem. Duis aliquam convallis nunc. Proin at turpis a pede posuere nonummy. Integer non velit. Donec diam neque, vestibulum eget, vulputate ut, ultrices vel, augue. Vestibulum ante ipsum primis in faucibus orci luctus et ultrices posuere cubilia Curae; Donec pharetra, magna vestibulum aliquet ultrices, erat tortor sollicitudin mi, sit amet lobortis sapien sapien non mi. Integer ac neque. Duis bibendum. Morbi non quam nec dui luctus rutrum."
Haily,Standon,nymag.com,12,Gigazoom,Haily Standon,haily.standon@nymag.com,New,Email Campaign,1005,Morbi non quam nec dui luctus rutrum. Nulla tellus. In sagittis dui vel nisl. Duis ac nibh.
Trixie,Treweela,aboutads.info,13,Tambee,Trixie Treweela,trixie.treweela@aboutads.info,Won,Email Campaign,1013,"Vestibulum quam sapien, varius ut, blandit non, interdum in, ante. Vestibulum ante ipsum primis in faucibus orci luctus et ultrices posuere cubilia Curae; Duis faucibus accumsan odio."
Rustin,Gallehock,umn.edu,14,Jaxbean,Rustin Gallehock,rustin.gallehock@umn.edu,Contacted,Web,1049,Etiam justo. Etiam pretium iaculis justo. In hac habitasse platea dictumst. Etiam faucibus cursus urna. Ut tellus. Nulla ut erat id mauris vulputate elementum. Nullam varius.
Anderson,Menere,berkeley.edu,15,Tagopia,Anderson Menere,anderson.menere@berkeley.edu,Contacted,Event,1040,"Ut tellus. Nulla ut erat id mauris vulputate elementum. Nullam varius. Nulla facilisi. Cras non velit nec nisi vulputate nonummy. Maecenas tincidunt lacus at velit. Vivamus vel nulla eget eros elementum pellentesque. Quisque porta volutpat erat. Quisque erat eros, viverra eget, congue eget, semper rutrum, nulla."
Keenan,O'Henery,google.es,16,Thoughtworks,Keenan O'Henery,keenan.o'henery@google.es,Contacted,Web,1043,"Integer tincidunt ante vel ipsum. Praesent blandit lacinia erat. Vestibulum sed magna at nunc commodo placerat. Praesent blandit. Nam nulla. Integer pede justo, lacinia eget, tincidunt eget, tempus vel, pede. Morbi porttitor lorem id ligula. Suspendisse ornare consequat lectus. In est risus, auctor sed, tristique in, tempus sit amet, sem. Fusce consequat."
Sunny,Adame,admin.ch,17,Voolith,Sunny Adame,sunny.adame@admin.ch,Contacted,Referral,1034,Donec posuere metus vitae ipsum. Aliquam non mauris.
Alessandra,Edelmann,trellian.com,18,Feednation,Alessandra Edelmann,alessandra.edelmann@trellian.com,Lost,Email Campaign,1025,"Nam congue, risus semper porta volutpat, quam pede lobortis ligula, sit amet eleifend pede libero quis orci. Nullam molestie nibh in lectus. Pellentesque at nulla. Suspendisse potenti. Cras in purus eu magna vulputate luctus. Cum sociis natoque penatibus et magnis dis parturient montes, nascetur ridiculus mus. Vivamus vestibulum sagittis sapien. Cum sociis natoque penatibus et magnis dis parturient montes, nascetur ridiculus mus. Etiam vel augue. Vestibulum rutrum rutrum neque."
Pincus,Kynge,noaa.gov,19,Rhyzio,Pincus Kynge,pincus.kynge@noaa.gov,Contacted,Email Campaign,1010,"Vivamus in felis eu sapien cursus vestibulum. Proin eu mi. Nulla ac enim. In tempor, turpis nec euismod scelerisque, quam turpis adipiscing lorem, vitae mattis nibh ligula nec sem. Duis aliquam convallis nunc."
Jessa,Lucock,house.gov,20,Demizz,Jessa Lucock,jessa.lucock@house.gov,Lost,Event,1024,"In est risus, auctor sed, tristique in, tempus sit amet, sem. Fusce consequat. Nulla nisl. Nunc nisl. Duis bibendum, felis sed interdum venenatis, turpis enim blandit mi, in porttitor pede justo eu massa. Donec dapibus."
Penny,Liversedge,acquirethisname.com,21,Jatri,Penny Liversedge,penny.liversedge@acquirethisname.com,Won,LinkedIn,1050,Vestibulum sed magna at nunc commodo placerat. Praesent blandit. Nam nulla.
Leda,Coale,reverbnation.com,22,Zooveo,Leda Coale,leda.coale@reverbnation.com,Contacted,LinkedIn,1004,"Nulla neque libero, convallis eget, eleifend luctus, ultricies eu, nibh. Quisque id justo sit amet sapien dignissim vestibulum. Vestibulum ante ipsum primis in faucibus orci luctus et ultrices posuere cubilia Curae; Nulla dapibus dolor vel est. Donec odio justo, sollicitudin ut, suscipit a, feugiat et, eros. Vestibulum ac est lacinia nisi venenatis tristique. Fusce congue, diam id ornare imperdiet, sapien urna pretium nisl, ut volutpat sapien arcu sed augue. Aliquam erat volutpat. In congue. Etiam justo."
Tyrus,O'Shevlan,ameblo.jp,23,Bluezoom,Tyrus O'Shevlan,tyrus.o'shevlan@ameblo.jp,Contacted,Email Campaign,1029,"Donec dapibus. Duis at velit eu est congue elementum. In hac habitasse platea dictumst. Morbi vestibulum, velit id pretium iaculis, diam erat fermentum justo, nec condimentum neque sapien placerat ante. Nulla justo. Aliquam quis turpis eget elit sodales scelerisque."
Malinde,Hatherell,nba.com,24,Dabfeed,Malinde Hatherell,malinde.hatherell@nba.com,Won,Email Campaign,1035,Suspendisse potenti.
Isidore,Raison,google.cn,25,Kaymbo,Isidore Raison,isidore.raison@google.cn,Contacted,Email Campaign,1002,Ut tellus. Nulla ut erat id mauris vulputate elementum. Nullam varius. Nulla facilisi. Cras non velit nec nisi vulputate nonummy. Maecenas tincidunt lacus at velit. Vivamus vel nulla eget eros elementum pellentesque. Quisque porta volutpat erat.
Jacky,Stribling,umn.edu,26,Linkbridge,Jacky Stribling,jacky.stribling@umn.edu,New,Email Campaign,1028,Suspendisse potenti. Cras in purus eu magna vulputate luctus.
Tammy,Farmery,mayoclinic.com,27,Blogtag,Tammy Farmery,tammy.farmery@mayoclinic.com,Lost,Event,1005,"Donec quis orci eget orci vehicula condimentum. Curabitur in libero ut massa volutpat convallis. Morbi odio odio, elementum eu, interdum eu, tincidunt in, leo. Maecenas pulvinar lobortis est. Phasellus sit amet erat. Nulla tempus."
Cos,Fletham,vimeo.com,28,Browsebug,Cos Fletham,cos.fletham@vimeo.com,Contacted,Referral,1002,"Pellentesque viverra pede ac diam. Cras pellentesque volutpat dui. Maecenas tristique, est et tempus semper, est quam pharetra magna, ac consequat metus sapien ut nunc. Vestibulum ante ipsum primis in faucibus orci luctus et ultrices posuere cubilia Curae; Mauris viverra diam vitae quam. Suspendisse potenti. Nullam porttitor lacus at turpis."
Quincy,Thredder,prnewswire.com,29,Blogtag,Quincy Thredder,quincy.thredder@prnewswire.com,Lost,Referral,1005,"Mauris enim leo, rhoncus sed, vestibulum sit amet, cursus id, turpis."
Merilee,Aland,sogou.com,30,Eidel,Merilee Aland,merilee.aland@sogou.com,Contacted,Web,1034,Nulla justo.
Alida,Todman,bloglines.com,31,Oozz,Alida Todman,alida.todman@bloglines.com,Lost,Referral,1046,Nulla justo. Aliquam quis turpis eget elit sodales scelerisque. Mauris sit amet eros. Suspendisse accumsan tortor quis turpis. Sed ante. Vivamus tortor. Duis mattis egestas metus. Aenean fermentum.
Britta,Dot,about.me,32,Abata,Britta Dot,britta.dot@about.me,Won,Referral,1006,"Nulla neque libero, convallis eget, eleifend luctus, ultricies eu, nibh. Quisque id justo sit amet sapien dignissim vestibulum. Vestibulum ante ipsum primis in faucibus orci luctus et ultrices posuere cubilia Curae; Nulla dapibus dolor vel est. Donec odio justo, sollicitudin ut, suscipit a, feugiat et, eros. Vestibulum ac est lacinia nisi venenatis tristique. Fusce congue, diam id ornare imperdiet, sapien urna pretium nisl, ut volutpat sapien arcu sed augue. Aliquam erat volutpat. In congue. Etiam justo."
Warner,Joan,paypal.com,33,Flashdog,Warner Joan,warner.joan@paypal.com,Lost,Event,1015,Ut tellus. Nulla ut erat id mauris vulputate elementum. Nullam varius.
Eldin,Gregr,un.org,34,Livepath,Eldin Gregr,eldin.gregr@un.org,Lost,Event,1049,Aenean lectus. Pellentesque eget nunc.
Lionello,Halley,themeforest.net,35,Jabbersphere,Lionello Halley,lionello.halley@themeforest.net,Contacted,Web,1033,"Lorem ipsum dolor sit amet, consectetuer adipiscing elit."
Terrie,O'Sharkey,va.gov,36,Eamia,Terrie O'Sharkey,terrie.o'sharkey@va.gov,Lost,Web,1019,"Nullam orci pede, venenatis non, sodales sed, tincidunt eu, felis. Fusce posuere felis sed lacus. Morbi sem mauris, laoreet ut, rhoncus aliquet, pulvinar sed, nisl. Nunc rhoncus dui vel sem. Sed sagittis. Nam congue, risus semper porta volutpat, quam pede lobortis ligula, sit amet eleifend pede libero quis orci."
Jared,Birkett,delicious.com,37,Realpoint,Jared Birkett,jared.birkett@delicious.com,Lost,Email Campaign,1022,Donec dapibus.
Thomas,Burgoyne,vkontakte.ru,38,Realfire,Thomas Burgoyne,thomas.burgoyne@vkontakte.ru,Lost,Email Campaign,1023,"Donec diam neque, vestibulum eget, vulputate ut, ultrices vel, augue. Vestibulum ante ipsum primis in faucibus orci luctus et ultrices posuere cubilia Curae; Donec pharetra, magna vestibulum aliquet ultrices, erat tortor sollicitudin mi, sit amet lobortis sapien sapien non mi. Integer ac neque. Duis bibendum. Morbi non quam nec dui luctus rutrum. Nulla tellus. In sagittis dui vel nisl."
Rosalie,Liddiard,gov.uk,39,Yakitri,Rosalie Liddiard,rosalie.liddiard@gov.uk,Won,Web,1036,Praesent blandit lacinia erat. Vestibulum sed magna at nunc commodo placerat. Praesent blandit. Nam nulla.
Kaleena,Amyes,networksolutions.com,40,Jamia,Kaleena Amyes,kaleena.amyes@networksolutions.com,New,Event,1033,"Donec dapibus. Duis at velit eu est congue elementum. In hac habitasse platea dictumst. Morbi vestibulum, velit id pretium iaculis, diam erat fermentum justo, nec condimentum neque sapien placerat ante. Nulla justo. Aliquam quis turpis eget elit sodales scelerisque. Mauris sit amet eros."
Vin,Milland,zimbio.com,41,Jayo,Vin Milland,vin.milland@zimbio.com,Contacted,Web,1006,Donec quis orci eget orci vehicula condimentum. Curabitur in libero ut massa volutpat convallis.
Roberto,Oddey,oakley.com,42,Fanoodle,Roberto Oddey,roberto.oddey@oakley.com,Lost,Email Campaign,1002,"Quisque porta volutpat erat. Quisque erat eros, viverra eget, congue eget, semper rutrum, nulla. Nunc purus. Phasellus in felis. Donec semper sapien a libero. Nam dui. Proin leo odio, porttitor id, consequat in, consequat ut, nulla. Sed accumsan felis. Ut at dolor quis odio consequat varius. Integer ac leo."
Alix,Goodswen,privacy.gov.au,43,Trilia,Alix Goodswen,alix.goodswen@privacy.gov.au,Contacted,Email Campaign,1021,"Donec vitae nisi. Nam ultrices, libero non mattis pulvinar, nulla pede ullamcorper augue, a suscipit nulla elit ac nulla. Sed vel enim sit amet nunc viverra dapibus. Nulla suscipit ligula in lacus."
Boot,Swynfen,godaddy.com,44,Zava,Boot Swynfen,boot.swynfen@godaddy.com,Lost,Web,1005,"Integer ac neque. Duis bibendum. Morbi non quam nec dui luctus rutrum. Nulla tellus. In sagittis dui vel nisl. Duis ac nibh. Fusce lacus purus, aliquet at, feugiat non, pretium quis, lectus. Suspendisse potenti."
Robena,Oulett,histats.com,45,Skyndu,Robena Oulett,robena.oulett@histats.com,Contacted,Email Campaign,1011,"Vestibulum ante ipsum primis in faucibus orci luctus et ultrices posuere cubilia Curae; Duis faucibus accumsan odio. Curabitur convallis. Duis consequat dui nec nisi volutpat eleifend. Donec ut dolor. Morbi vel lectus in quam fringilla rhoncus. Mauris enim leo, rhoncus sed, vestibulum sit amet, cursus id, turpis. Integer aliquet, massa id lobortis convallis, tortor risus dapibus augue, vel accumsan tellus nisi eu orci."
Martie,Gowanson,huffingtonpost.com,46,Gabvine,Martie Gowanson,martie.gowanson@huffingtonpost.com,New,Web,1044,Morbi a ipsum. Integer a nibh. In quis justo. Maecenas rhoncus aliquam lacus.
Maurine,Lucus,house.gov,47,Voonte,Maurine Lucus,maurine.lucus@house.gov,Contacted,Web,1036,"Vestibulum rutrum rutrum neque. Aenean auctor gravida sem. Praesent id massa id nisl venenatis lacinia. Aenean sit amet justo. Morbi ut odio. Cras mi pede, malesuada in, imperdiet et, commodo vulputate, justo. In blandit ultrices enim. Lorem ipsum dolor sit amet, consectetuer adipiscing elit. Proin interdum mauris non ligula pellentesque ultrices."
Jud,Bolger,scribd.com,48,Avamm,Jud Bolger,jud.bolger@scribd.com,New,Email Campaign,1008,"Maecenas tristique, est et tempus semper, est quam pharetra magna, ac consequat metus sapien ut nunc. Vestibulum ante ipsum primis in faucibus orci luctus et ultrices posuere cubilia Curae; Mauris viverra diam vitae quam."
Hannie,Shore,artisteer.com,49,Leexo,Hannie Shore,hannie.shore@artisteer.com,Lost,Email Campaign,1032,"Maecenas leo odio, condimentum id, luctus nec, molestie sed, justo. Pellentesque viverra pede ac diam. Cras pellentesque volutpat dui."
Brendin,Duck,toplist.cz,50,Trudoo,Brendin Duck,brendin.duck@toplist.cz,Won,Event,1025,"Nulla facilisi. Cras non velit nec nisi vulputate nonummy. Maecenas tincidunt lacus at velit. Vivamus vel nulla eget eros elementum pellentesque. Quisque porta volutpat erat. Quisque erat eros, viverra eget, congue eget, semper rutrum, nulla. Nunc purus. Phasellus in felis. Donec semper sapien a libero. Nam dui."
Georas,Wigin,youtube.com,51,Wordtune,Georas Wigin,georas.wigin@youtube.com,Lost,Web,1024,"Aliquam non mauris. Morbi non lectus. Aliquam sit amet diam in magna bibendum imperdiet. Nullam orci pede, venenatis non, sodales sed, tincidunt eu, felis. Fusce posuere felis sed lacus. Morbi sem mauris, laoreet ut, rhoncus aliquet, pulvinar sed, nisl. Nunc rhoncus dui vel sem. Sed sagittis. Nam congue, risus semper porta volutpat, quam pede lobortis ligula, sit amet eleifend pede libero quis orci. Nullam molestie nibh in lectus."
Clarey,Bleasdille,arizona.edu,52,Quimm,Clarey Bleasdille,clarey.bleasdille@arizona.edu,Contacted,Email Campaign,1005,Nunc nisl.
Jenn,Waliszewski,flickr.com,53,Yata,Jenn Waliszewski,jenn.waliszewski@flickr.com,Won,Referral,1028,"Nulla neque libero, convallis eget, eleifend luctus, ultricies eu, nibh. Quisque id justo sit amet sapien dignissim vestibulum. Vestibulum ante ipsum primis in faucibus orci luctus et ultrices posuere cubilia Curae; Nulla dapibus dolor vel est. Donec odio justo, sollicitudin ut, suscipit a, feugiat et, eros. Vestibulum ac est lacinia nisi venenatis tristique. Fusce congue, diam id ornare imperdiet, sapien urna pretium nisl, ut volutpat sapien arcu sed augue. Aliquam erat volutpat."
Maegan,Winslet,networksolutions.com,54,Leexo,Maegan Winslet,maegan.winslet@networksolutions.com,Won,Email Campaign,1023,Integer tincidunt ante vel ipsum. Praesent blandit lacinia erat. Vestibulum sed magna at nunc commodo placerat. Praesent blandit.
Bay,Gasnell,si.edu,55,Feednation,Bay Gasnell,bay.gasnell@si.edu,Contacted,Event,1037,"Vivamus metus arcu, adipiscing molestie, hendrerit at, vulputate vitae, nisl. Aenean lectus. Pellentesque eget nunc. Donec quis orci eget orci vehicula condimentum. Curabitur in libero ut massa volutpat convallis. Morbi odio odio, elementum eu, interdum eu, tincidunt in, leo."
Hyacintha,Swalwel,washington.edu,56,Ozu,Hyacintha Swalwel,hyacintha.swalwel@washington.edu,Lost,LinkedIn,1005,Nulla mollis molestie lorem.
Boigie,Windress,shutterfly.com,57,Feednation,Boigie Windress,boigie.windress@shutterfly.com,Contacted,Referral,1039,"Proin eu mi. Nulla ac enim. In tempor, turpis nec euismod scelerisque, quam turpis adipiscing lorem, vitae mattis nibh ligula nec sem. Duis aliquam convallis nunc. Proin at turpis a pede posuere nonummy. Integer non velit."
Yolanthe,De Vuyst,1688.com,58,Topicblab,Yolanthe De Vuyst,yolanthe.de vuyst@1688.com,Contacted,LinkedIn,1027,"Quisque erat eros, viverra eget, congue eget, semper rutrum, nulla. Nunc purus. Phasellus in felis. Donec semper sapien a libero. Nam dui. Proin leo odio, porttitor id, consequat in, consequat ut, nulla."
Sancho,Wyld,ftc.gov,59,Twitterwire,Sancho Wyld,sancho.wyld@ftc.gov,New,Event,1042,"Phasellus in felis. Donec semper sapien a libero. Nam dui. Proin leo odio, porttitor id, consequat in, consequat ut, nulla. Sed accumsan felis."
Theda,Arcase,netvibes.com,60,Livetube,Theda Arcase,theda.arcase@netvibes.com,Won,Web,1006,"Proin at turpis a pede posuere nonummy. Integer non velit. Donec diam neque, vestibulum eget, vulputate ut, ultrices vel, augue."
Clair,Romushkin,mapy.cz,61,Viva,Clair Romushkin,clair.romushkin@mapy.cz,Contacted,Event,1012,"Duis aliquam convallis nunc. Proin at turpis a pede posuere nonummy. Integer non velit. Donec diam neque, vestibulum eget, vulputate ut, ultrices vel, augue. Vestibulum ante ipsum primis in faucibus orci luctus et ultrices posuere cubilia Curae; Donec pharetra, magna vestibulum aliquet ultrices, erat tortor sollicitudin mi, sit amet lobortis sapien sapien non mi. Integer ac neque. Duis bibendum. Morbi non quam nec dui luctus rutrum. Nulla tellus. In sagittis dui vel nisl."
Saw,Cubberley,intel.com,62,Fivebridge,Saw Cubberley,saw.cubberley@intel.com,Lost,Email Campaign,1009,Sed ante. Vivamus tortor. Duis mattis egestas metus. Aenean fermentum.
Nikoletta,Durrance,dell.com,63,Browsedrive,Nikoletta Durrance,nikoletta.durrance@dell.com,Lost,Event,1040,Nulla tempus. Vivamus in felis eu sapien cursus vestibulum. Proin eu mi.
Cammie,Furmage,yahoo.com,64,Photofeed,Cammie Furmage,cammie.furmage@yahoo.com,Lost,LinkedIn,1023,In hac habitasse platea dictumst. Etiam faucibus cursus urna. Ut tellus. Nulla ut erat id mauris vulputate elementum. Nullam varius. Nulla facilisi.
Sela,Dyneley,census.gov,65,Devify,Sela Dyneley,sela.dyneley@census.gov,New,Event,1049,Vestibulum ac est lacinia nisi venenatis tristique.
Debi,Skin,t.co,66,Livetube,Debi Skin,debi.skin@t.co,Contacted,Event,1050,Praesent id massa id nisl venenatis lacinia. Aenean sit amet justo. Morbi ut odio.
Arlin,GiacobbiniJacob,shutterfly.com,67,Skajo,Arlin GiacobbiniJacob,arlin.giacobbinijacob@shutterfly.com,New,Referral,1049,"Nulla tellus. In sagittis dui vel nisl. Duis ac nibh. Fusce lacus purus, aliquet at, feugiat non, pretium quis, lectus. Suspendisse potenti. In eleifend quam a odio. In hac habitasse platea dictumst. Maecenas ut massa quis augue luctus tincidunt. Nulla mollis molestie lorem. Quisque ut erat."
Boot,Barnfield,trellian.com,68,Topiczoom,Boot Barnfield,boot.barnfield@trellian.com,Won,Event,1025,Duis consequat dui nec nisi volutpat eleifend. Donec ut dolor. Morbi vel lectus in quam fringilla rhoncus.
Ellsworth,Patek,hhs.gov,69,Meemm,Ellsworth Patek,ellsworth.patek@hhs.gov,Lost,Event,1041,Vivamus vestibulum sagittis sapien.
Sayers,Collymore,trellian.com,70,Buzzshare,Sayers Collymore,sayers.collymore@trellian.com,Contacted,Web,1029,"Donec odio justo, sollicitudin ut, suscipit a, feugiat et, eros."
Ilene,Snazel,cpanel.net,71,Vidoo,Ilene Snazel,ilene.snazel@cpanel.net,Won,Web,1028,"Aenean lectus. Pellentesque eget nunc. Donec quis orci eget orci vehicula condimentum. Curabitur in libero ut massa volutpat convallis. Morbi odio odio, elementum eu, interdum eu, tincidunt in, leo. Maecenas pulvinar lobortis est."
Renado,Mixer,about.com,72,Ozu,Renado Mixer,renado.mixer@about.com,Lost,Event,1003,"Sed sagittis. Nam congue, risus semper porta volutpat, quam pede lobortis ligula, sit amet eleifend pede libero quis orci. Nullam molestie nibh in lectus. Pellentesque at nulla."
Craggy,Freegard,theguardian.com,73,Kimia,Craggy Freegard,craggy.freegard@theguardian.com,Contacted,Email Campaign,1027,"Nulla facilisi. Cras non velit nec nisi vulputate nonummy. Maecenas tincidunt lacus at velit. Vivamus vel nulla eget eros elementum pellentesque. Quisque porta volutpat erat. Quisque erat eros, viverra eget, congue eget, semper rutrum, nulla. Nunc purus. Phasellus in felis. Donec semper sapien a libero."
Panchito,Ouslem,ibm.com,74,Vitz,Panchito Ouslem,panchito.ouslem@ibm.com,Lost,Event,1046,"Morbi odio odio, elementum eu, interdum eu, tincidunt in, leo."
Gaspar,Spur,ed.gov,75,Bubbletube,Gaspar Spur,gaspar.spur@ed.gov,Won,LinkedIn,1049,"Fusce congue, diam id ornare imperdiet, sapien urna pretium nisl, ut volutpat sapien arcu sed augue. Aliquam erat volutpat. In congue. Etiam justo."
Alejandra,Synnott,amazon.de,76,Tagpad,Alejandra Synnott,alejandra.synnott@amazon.de,Won,Event,1042,"Proin risus. Praesent lectus. Vestibulum quam sapien, varius ut, blandit non, interdum in, ante. Vestibulum ante ipsum primis in faucibus orci luctus et ultrices posuere cubilia Curae; Duis faucibus accumsan odio. Curabitur convallis."
Walsh,Howsego,wikia.com,77,Miboo,Walsh Howsego,walsh.howsego@wikia.com,New,Referral,1027,Sed sagittis.
Adora,Stanlick,guardian.co.uk,78,Jabbertype,Adora Stanlick,adora.stanlick@guardian.co.uk,Contacted,Web,1003,"Duis bibendum. Morbi non quam nec dui luctus rutrum. Nulla tellus. In sagittis dui vel nisl. Duis ac nibh. Fusce lacus purus, aliquet at, feugiat non, pretium quis, lectus."
Mendy,Bennie,storify.com,79,Gabcube,Mendy Bennie,mendy.bennie@storify.com,Won,Event,1019,"Morbi vel lectus in quam fringilla rhoncus. Mauris enim leo, rhoncus sed, vestibulum sit amet, cursus id, turpis. Integer aliquet, massa id lobortis convallis, tortor risus dapibus augue, vel accumsan tellus nisi eu orci. Mauris lacinia sapien quis libero. Nullam sit amet turpis elementum ligula vehicula consequat. Morbi a ipsum."
Beatriz,Goldhawk,networksolutions.com,80,Oba,Beatriz Goldhawk,beatriz.goldhawk@networksolutions.com,Won,Email Campaign,1023,"Vestibulum ac est lacinia nisi venenatis tristique. Fusce congue, diam id ornare imperdiet, sapien urna pretium nisl, ut volutpat sapien arcu sed augue."
Austine,Huddlestone,taobao.com,81,Riffpedia,Austine Huddlestone,austine.huddlestone@taobao.com,Contacted,Event,1046,"Nulla mollis molestie lorem. Quisque ut erat. Curabitur gravida nisi at nibh. In hac habitasse platea dictumst. Aliquam augue quam, sollicitudin vitae, consectetuer eget, rutrum at, lorem. Integer tincidunt ante vel ipsum. Praesent blandit lacinia erat. Vestibulum sed magna at nunc commodo placerat. Praesent blandit. Nam nulla."
Livvy,Spensley,ftc.gov,82,Divanoodle,Livvy Spensley,livvy.spensley@ftc.gov,Lost,LinkedIn,1030,In congue. Etiam justo. Etiam pretium iaculis justo. In hac habitasse platea dictumst. Etiam faucibus cursus urna. Ut tellus. Nulla ut erat id mauris vulputate elementum. Nullam varius. Nulla facilisi. Cras non velit nec nisi vulputate nonummy.
Bradney,Sweetlove,cmu.edu,83,Livefish,Bradney Sweetlove,bradney.sweetlove@cmu.edu,Lost,Referral,1036,Nullam varius. Nulla facilisi. Cras non velit nec nisi vulputate nonummy. Maecenas tincidunt lacus at velit. Vivamus vel nulla eget eros elementum pellentesque. Quisque porta volutpat erat.
