first_name,last_name,domain_name,lead_id,company_name,contact_name,contact_email,lead_status,source,assigned_to,notes
Eberto,Tomas,dion.ne.jp,171,Livefish,Eberto Tomas,eberto.tomas@dion.ne.jp,New,Web,1006,"Pellentesque at nulla. Suspendisse potenti. Cras in purus eu magna vulputate luctus. Cum sociis natoque penatibus et magnis dis parturient montes, nascetur ridiculus mus. Vivamus vestibulum sagittis sapien. Cum sociis natoque penatibus et magnis dis parturient montes, nascetur ridiculus mus. Etiam vel augue."
Orson,Winchcomb,people.com.cn,172,Feedspan,Orson Winchcomb,orson.winchcomb@people.com.cn,New,Referral,1023,Nulla tempus. Vivamus in felis eu sapien cursus vestibulum. Proin eu mi. Nulla ac enim.
Raviv,Phair,china.com.cn,173,Shufflester,Raviv Phair,raviv.phair@china.com.cn,Contacted,LinkedIn,1006,"Vestibulum ac est lacinia nisi venenatis tristique. Fusce congue, diam id ornare imperdiet, sapien urna pretium nisl, ut volutpat sapien arcu sed augue. Aliquam erat volutpat. In congue. Etiam justo."
Ruperta,Betteson,soup.io,174,Cogilith,Ruperta Betteson,ruperta.betteson@soup.io,Lost,LinkedIn,1043,Suspendisse potenti. In eleifend quam a odio.
Brynn,Bellson,google.pl,175,Meemm,Brynn Bellson,brynn.bellson@google.pl,Contacted,Event,1047,"Duis bibendum. Morbi non quam nec dui luctus rutrum. Nulla tellus. In sagittis dui vel nisl. Duis ac nibh. Fusce lacus purus, aliquet at, feugiat non, pretium quis, lectus. Suspendisse potenti."
Koren,Hellwing,typepad.com,176,Eire,Koren Hellwing,koren.hellwing@typepad.com,New,Event,1045,In hac habitasse platea dictumst.
Abbye,Capun,bbc.co.uk,177,Plajo,Abbye Capun,abbye.capun@bbc.co.uk,New,Email Campaign,1047,"Nulla neque libero, convallis eget, eleifend luctus, ultricies eu, nibh. Quisque id justo sit amet sapien dignissim vestibulum. Vestibulum ante ipsum primis in faucibus orci luctus et ultrices posuere cubilia Curae; Nulla dapibus dolor vel est. Donec odio justo, sollicitudin ut, suscipit a, feugiat et, eros. Vestibulum ac est lacinia nisi venenatis tristique. Fusce congue, diam id ornare imperdiet, sapien urna pretium nisl, ut volutpat sapien arcu sed augue."
Camille,Tharme,deviantart.com,178,InnoZ,Camille Tharme,camille.tharme@deviantart.com,Contacted,Event,1006,Duis aliquam convallis nunc. Proin at turpis a pede posuere nonummy. Integer non velit.
Abrahan,Geri,desdev.cn,179,Kwideo,Abrahan Geri,abrahan.geri@desdev.cn,Lost,Email Campaign,1018,"Vestibulum sed magna at nunc commodo placerat. Praesent blandit. Nam nulla. Integer pede justo, lacinia eget, tincidunt eget, tempus vel, pede. Morbi porttitor lorem id ligula. Suspendisse ornare consequat lectus. In est risus, auctor sed, tristique in, tempus sit amet, sem. Fusce consequat."
Clair,Sallenger,linkedin.com,180,Wikibox,Clair Sallenger,clair.sallenger@linkedin.com,New,Email Campaign,1003,Aliquam erat volutpat. In congue. Etiam justo. Etiam pretium iaculis justo. In hac habitasse platea dictumst.
Orelie,Shimon,independent.co.uk,181,Skyble,Orelie Shimon,orelie.shimon@independent.co.uk,Won,Web,1028,Nullam porttitor lacus at turpis. Donec posuere metus vitae ipsum. Aliquam non mauris. Morbi non lectus.
Anthe,Dallewater,cbsnews.com,182,Jatri,Anthe Dallewater,anthe.dallewater@cbsnews.com,Lost,LinkedIn,1025,"Maecenas rhoncus aliquam lacus. Morbi quis tortor id nulla ultrices aliquet. Maecenas leo odio, condimentum id, luctus nec, molestie sed, justo. Pellentesque viverra pede ac diam. Cras pellentesque volutpat dui. Maecenas tristique, est et tempus semper, est quam pharetra magna, ac consequat metus sapien ut nunc. Vestibulum ante ipsum primis in faucibus orci luctus et ultrices posuere cubilia Curae; Mauris viverra diam vitae quam. Suspendisse potenti."
Delano,Curedell,tinypic.com,183,Edgeify,Delano Curedell,delano.curedell@tinypic.com,Won,Email Campaign,1013,"Donec quis orci eget orci vehicula condimentum. Curabitur in libero ut massa volutpat convallis. Morbi odio odio, elementum eu, interdum eu, tincidunt in, leo. Maecenas pulvinar lobortis est. Phasellus sit amet erat. Nulla tempus. Vivamus in felis eu sapien cursus vestibulum."
Engelbert,Baum,eepurl.com,184,Twinte,Engelbert Baum,engelbert.baum@eepurl.com,Contacted,Web,1021,"Donec ut dolor. Morbi vel lectus in quam fringilla rhoncus. Mauris enim leo, rhoncus sed, vestibulum sit amet, cursus id, turpis. Integer aliquet, massa id lobortis convallis, tortor risus dapibus augue, vel accumsan tellus nisi eu orci. Mauris lacinia sapien quis libero. Nullam sit amet turpis elementum ligula vehicula consequat. Morbi a ipsum. Integer a nibh. In quis justo. Maecenas rhoncus aliquam lacus."
Mignonne,Krysztofiak,mediafire.com,185,Avaveo,Mignonne Krysztofiak,mignonne.krysztofiak@mediafire.com,Lost,Referral,1014,Integer tincidunt ante vel ipsum.
Julianne,Ruberry,nymag.com,186,Rhycero,Julianne Ruberry,julianne.ruberry@nymag.com,New,Web,1029,"Proin risus. Praesent lectus. Vestibulum quam sapien, varius ut, blandit non, interdum in, ante. Vestibulum ante ipsum primis in faucibus orci luctus et ultrices posuere cubilia Curae; Duis faucibus accumsan odio. Curabitur convallis. Duis consequat dui nec nisi volutpat eleifend. Donec ut dolor."
Devlen,Hellmore,virginia.edu,187,Photospace,Devlen Hellmore,devlen.hellmore@virginia.edu,Contacted,LinkedIn,1020,"Aliquam sit amet diam in magna bibendum imperdiet. Nullam orci pede, venenatis non, sodales sed, tincidunt eu, felis. Fusce posuere felis sed lacus. Morbi sem mauris, laoreet ut, rhoncus aliquet, pulvinar sed, nisl."
Maureene,Jarman,who.int,188,Chatterpoint,Maureene Jarman,maureene.jarman@who.int,Contacted,Event,1009,"Praesent blandit. Nam nulla. Integer pede justo, lacinia eget, tincidunt eget, tempus vel, pede. Morbi porttitor lorem id ligula."
Lianne,Rout,earthlink.net,189,Lazzy,Lianne Rout,lianne.rout@earthlink.net,Contacted,Email Campaign,1046,"Vestibulum quam sapien, varius ut, blandit non, interdum in, ante. Vestibulum ante ipsum primis in faucibus orci luctus et ultrices posuere cubilia Curae; Duis faucibus accumsan odio. Curabitur convallis. Duis consequat dui nec nisi volutpat eleifend. Donec ut dolor. Morbi vel lectus in quam fringilla rhoncus. Mauris enim leo, rhoncus sed, vestibulum sit amet, cursus id, turpis. Integer aliquet, massa id lobortis convallis, tortor risus dapibus augue, vel accumsan tellus nisi eu orci. Mauris lacinia sapien quis libero."
Courtnay,Scurr,engadget.com,190,Topicstorm,Courtnay Scurr,courtnay.scurr@engadget.com,New,Email Campaign,1003,"Vestibulum ante ipsum primis in faucibus orci luctus et ultrices posuere cubilia Curae; Nulla dapibus dolor vel est. Donec odio justo, sollicitudin ut, suscipit a, feugiat et, eros. Vestibulum ac est lacinia nisi venenatis tristique. Fusce congue, diam id ornare imperdiet, sapien urna pretium nisl, ut volutpat sapien arcu sed augue. Aliquam erat volutpat. In congue. Etiam justo. Etiam pretium iaculis justo."
Brant,Bartoleyn,behance.net,191,Photobug,Brant Bartoleyn,brant.bartoleyn@behance.net,Won,LinkedIn,1019,"Integer pede justo, lacinia eget, tincidunt eget, tempus vel, pede. Morbi porttitor lorem id ligula. Suspendisse ornare consequat lectus. In est risus, auctor sed, tristique in, tempus sit amet, sem. Fusce consequat. Nulla nisl. Nunc nisl. Duis bibendum, felis sed interdum venenatis, turpis enim blandit mi, in porttitor pede justo eu massa."
Kiersten,Lillecrap,yahoo.com,192,Roomm,Kiersten Lillecrap,kiersten.lillecrap@yahoo.com,Lost,Email Campaign,1031,Morbi non lectus. Aliquam sit amet diam in magna bibendum imperdiet.
Rowen,Artiss,webeden.co.uk,193,Feedbug,Rowen Artiss,rowen.artiss@webeden.co.uk,New,Referral,1031,"Aenean lectus. Pellentesque eget nunc. Donec quis orci eget orci vehicula condimentum. Curabitur in libero ut massa volutpat convallis. Morbi odio odio, elementum eu, interdum eu, tincidunt in, leo. Maecenas pulvinar lobortis est."
Eziechiele,Queen,blogspot.com,194,Ailane,Eziechiele Queen,eziechiele.queen@blogspot.com,Won,Web,1002,"Suspendisse potenti. Cras in purus eu magna vulputate luctus. Cum sociis natoque penatibus et magnis dis parturient montes, nascetur ridiculus mus. Vivamus vestibulum sagittis sapien. Cum sociis natoque penatibus et magnis dis parturient montes, nascetur ridiculus mus. Etiam vel augue. Vestibulum rutrum rutrum neque."
Valina,Idwal Evans,google.co.jp,195,Kanoodle,Valina Idwal Evans,valina.idwal evans@google.co.jp,New,Event,1043,"Suspendisse potenti. Cras in purus eu magna vulputate luctus. Cum sociis natoque penatibus et magnis dis parturient montes, nascetur ridiculus mus. Vivamus vestibulum sagittis sapien. Cum sociis natoque penatibus et magnis dis parturient montes, nascetur ridiculus mus. Etiam vel augue. Vestibulum rutrum rutrum neque. Aenean auctor gravida sem. Praesent id massa id nisl venenatis lacinia."
Fawne,Tippett,nih.gov,196,Camimbo,Fawne Tippett,fawne.tippett@nih.gov,Lost,LinkedIn,1045,"Aliquam sit amet diam in magna bibendum imperdiet. Nullam orci pede, venenatis non, sodales sed, tincidunt eu, felis."
Darleen,Douch,scientificamerican.com,197,Shuffledrive,Darleen Douch,darleen.douch@scientificamerican.com,Contacted,Referral,1037,Integer tincidunt ante vel ipsum. Praesent blandit lacinia erat. Vestibulum sed magna at nunc commodo placerat. Praesent blandit. Nam nulla.
Carroll,Toope,zdnet.com,198,Buzzbean,Carroll Toope,carroll.toope@zdnet.com,New,Event,1032,"Morbi vestibulum, velit id pretium iaculis, diam erat fermentum justo, nec condimentum neque sapien placerat ante. Nulla justo."
Thaddeus,Rapson,nifty.com,199,Edgepulse,Thaddeus Rapson,thaddeus.rapson@nifty.com,Lost,Email Campaign,1015,Vestibulum ante ipsum primis in faucibus orci luctus et ultrices posuere cubilia Curae; Duis faucibus accumsan odio. Curabitur convallis.
Darbee,Showers,cbslocal.com,200,Myworks,Darbee Showers,darbee.showers@cbslocal.com,Contacted,Referral,1018,"Nulla tellus. In sagittis dui vel nisl. Duis ac nibh. Fusce lacus purus, aliquet at, feugiat non, pretium quis, lectus. Suspendisse potenti. In eleifend quam a odio. In hac habitasse platea dictumst. Maecenas ut massa quis augue luctus tincidunt."
Jade,Cochran,shutterfly.com,201,Tanoodle,Jade Cochran,jade.cochran@shutterfly.com,Lost,Event,1034,"Morbi odio odio, elementum eu, interdum eu, tincidunt in, leo. Maecenas pulvinar lobortis est. Phasellus sit amet erat. Nulla tempus. Vivamus in felis eu sapien cursus vestibulum."
Doug,Matzaitis,uol.com.br,202,Tagfeed,Doug Matzaitis,doug.matzaitis@uol.com.br,New,Event,1049,"Nam ultrices, libero non mattis pulvinar, nulla pede ullamcorper augue, a suscipit nulla elit ac nulla."
Aggie,Glenwright,mozilla.org,203,Katz,Aggie Glenwright,aggie.glenwright@mozilla.org,New,LinkedIn,1042,"Nunc rhoncus dui vel sem. Sed sagittis. Nam congue, risus semper porta volutpat, quam pede lobortis ligula, sit amet eleifend pede libero quis orci. Nullam molestie nibh in lectus. Pellentesque at nulla. Suspendisse potenti."
Cazzie,Stobbs,tmall.com,204,Blogpad,Cazzie Stobbs,cazzie.stobbs@tmall.com,Contacted,LinkedIn,1007,"Integer pede justo, lacinia eget, tincidunt eget, tempus vel, pede. Morbi porttitor lorem id ligula. Suspendisse ornare consequat lectus. In est risus, auctor sed, tristique in, tempus sit amet, sem. Fusce consequat. Nulla nisl. Nunc nisl. Duis bibendum, felis sed interdum venenatis, turpis enim blandit mi, in porttitor pede justo eu massa. Donec dapibus. Duis at velit eu est congue elementum."
Alex,Blase,mashable.com,205,Katz,Alex Blase,alex.blase@mashable.com,Contacted,Email Campaign,1009,"Donec ut dolor. Morbi vel lectus in quam fringilla rhoncus. Mauris enim leo, rhoncus sed, vestibulum sit amet, cursus id, turpis. Integer aliquet, massa id lobortis convallis, tortor risus dapibus augue, vel accumsan tellus nisi eu orci. Mauris lacinia sapien quis libero. Nullam sit amet turpis elementum ligula vehicula consequat. Morbi a ipsum. Integer a nibh. In quis justo. Maecenas rhoncus aliquam lacus."
Dorolice,Cawood,shutterfly.com,206,Jabbercube,Dorolice Cawood,dorolice.cawood@shutterfly.com,Lost,Web,1029,Phasellus in felis. Donec semper sapien a libero. Nam dui.
Etta,Waryk,smugmug.com,207,Oba,Etta Waryk,etta.waryk@smugmug.com,New,Referral,1030,Ut tellus. Nulla ut erat id mauris vulputate elementum.
Ferne,Harnott,umich.edu,208,Blogtags,Ferne Harnott,ferne.harnott@umich.edu,Contacted,Referral,1041,"Proin risus. Praesent lectus. Vestibulum quam sapien, varius ut, blandit non, interdum in, ante. Vestibulum ante ipsum primis in faucibus orci luctus et ultrices posuere cubilia Curae; Duis faucibus accumsan odio. Curabitur convallis. Duis consequat dui nec nisi volutpat eleifend. Donec ut dolor. Morbi vel lectus in quam fringilla rhoncus."
Pieter,Novello,ibm.com,209,Midel,Pieter Novello,pieter.novello@ibm.com,New,Email Campaign,1036,"Integer aliquet, massa id lobortis convallis, tortor risus dapibus augue, vel accumsan tellus nisi eu orci. Mauris lacinia sapien quis libero."
Freddy,Marsh,smugmug.com,210,Blogtag,Freddy Marsh,freddy.marsh@smugmug.com,Contacted,Referral,1005,"Duis at velit eu est congue elementum. In hac habitasse platea dictumst. Morbi vestibulum, velit id pretium iaculis, diam erat fermentum justo, nec condimentum neque sapien placerat ante. Nulla justo. Aliquam quis turpis eget elit sodales scelerisque. Mauris sit amet eros. Suspendisse accumsan tortor quis turpis. Sed ante."
Suzette,Castaignet,fda.gov,211,Yambee,Suzette Castaignet,suzette.castaignet@fda.gov,Lost,Event,1043,"Phasellus sit amet erat. Nulla tempus. Vivamus in felis eu sapien cursus vestibulum. Proin eu mi. Nulla ac enim. In tempor, turpis nec euismod scelerisque, quam turpis adipiscing lorem, vitae mattis nibh ligula nec sem. Duis aliquam convallis nunc."
Daisey,MacCleay,dyndns.org,212,Wordtune,Daisey MacCleay,daisey.maccleay@dyndns.org,Lost,LinkedIn,1014,"Maecenas pulvinar lobortis est. Phasellus sit amet erat. Nulla tempus. Vivamus in felis eu sapien cursus vestibulum. Proin eu mi. Nulla ac enim. In tempor, turpis nec euismod scelerisque, quam turpis adipiscing lorem, vitae mattis nibh ligula nec sem. Duis aliquam convallis nunc. Proin at turpis a pede posuere nonummy. Integer non velit."
Zenia,Gierhard,go.com,213,Flipstorm,Zenia Gierhard,zenia.gierhard@go.com,Won,Web,1010,Pellentesque at nulla. Suspendisse potenti. Cras in purus eu magna vulputate luctus.
Shalna,Rzehor,mapquest.com,214,LiveZ,Shalna Rzehor,shalna.rzehor@mapquest.com,New,Referral,1009,Aliquam quis turpis eget elit sodales scelerisque. Mauris sit amet eros. Suspendisse accumsan tortor quis turpis. Sed ante. Vivamus tortor. Duis mattis egestas metus. Aenean fermentum.
Lizette,Jacqueme,dion.ne.jp,215,Topicshots,Lizette Jacqueme,lizette.jacqueme@dion.ne.jp,New,LinkedIn,1032,Etiam vel augue.
Brod,Barrim,wunderground.com,216,Edgepulse,Brod Barrim,brod.barrim@wunderground.com,Lost,Referral,1021,"Proin risus. Praesent lectus. Vestibulum quam sapien, varius ut, blandit non, interdum in, ante."
Padgett,Cleiment,latimes.com,217,Jabbercube,Padgett Cleiment,padgett.cleiment@latimes.com,Won,Referral,1007,"Nulla ut erat id mauris vulputate elementum. Nullam varius. Nulla facilisi. Cras non velit nec nisi vulputate nonummy. Maecenas tincidunt lacus at velit. Vivamus vel nulla eget eros elementum pellentesque. Quisque porta volutpat erat. Quisque erat eros, viverra eget, congue eget, semper rutrum, nulla. Nunc purus."
Merv,Dundin,pagesperso-orange.fr,218,Leexo,Merv Dundin,merv.dundin@pagesperso-orange.fr,Lost,Referral,1013,"In hac habitasse platea dictumst. Morbi vestibulum, velit id pretium iaculis, diam erat fermentum justo, nec condimentum neque sapien placerat ante."
Fidelia,Rigg,tumblr.com,219,Centimia,Fidelia Rigg,fidelia.rigg@tumblr.com,Contacted,Event,1009,"Donec odio justo, sollicitudin ut, suscipit a, feugiat et, eros. Vestibulum ac est lacinia nisi venenatis tristique. Fusce congue, diam id ornare imperdiet, sapien urna pretium nisl, ut volutpat sapien arcu sed augue."
Lilah,Edlin,nytimes.com,220,Latz,Lilah Edlin,lilah.edlin@nytimes.com,New,Email Campaign,1035,"Nulla tempus. Vivamus in felis eu sapien cursus vestibulum. Proin eu mi. Nulla ac enim. In tempor, turpis nec euismod scelerisque, quam turpis adipiscing lorem, vitae mattis nibh ligula nec sem. Duis aliquam convallis nunc."
Rufus,Lintill,squarespace.com,221,Jatri,Rufus Lintill,rufus.lintill@squarespace.com,Won,Email Campaign,1046,"Integer pede justo, lacinia eget, tincidunt eget, tempus vel, pede. Morbi porttitor lorem id ligula. Suspendisse ornare consequat lectus."
Ynez,Gadie,adobe.com,222,Jetwire,Ynez Gadie,ynez.gadie@adobe.com,Won,Referral,1033,"Duis consequat dui nec nisi volutpat eleifend. Donec ut dolor. Morbi vel lectus in quam fringilla rhoncus. Mauris enim leo, rhoncus sed, vestibulum sit amet, cursus id, turpis. Integer aliquet, massa id lobortis convallis, tortor risus dapibus augue, vel accumsan tellus nisi eu orci. Mauris lacinia sapien quis libero."
Marketa,Mcimmie,hatena.ne.jp,223,Yoveo,Marketa Mcimmie,marketa.mcimmie@hatena.ne.jp,Lost,Event,1044,"Vestibulum ante ipsum primis in faucibus orci luctus et ultrices posuere cubilia Curae; Nulla dapibus dolor vel est. Donec odio justo, sollicitudin ut, suscipit a, feugiat et, eros."
Wenonah,Puden,buzzfeed.com,224,Avamm,Wenonah Puden,wenonah.puden@buzzfeed.com,Won,Web,1011,"Integer aliquet, massa id lobortis convallis, tortor risus dapibus augue, vel accumsan tellus nisi eu orci. Mauris lacinia sapien quis libero. Nullam sit amet turpis elementum ligula vehicula consequat. Morbi a ipsum. Integer a nibh. In quis justo."
Christi,Jedraszczyk,dot.gov,225,Linkbridge,Christi Jedraszczyk,christi.jedraszczyk@dot.gov,Won,Email Campaign,1019,Vestibulum ante ipsum primis in faucibus orci luctus et ultrices posuere cubilia Curae; Mauris viverra diam vitae quam.
Grace,Kean,exblog.jp,226,JumpXS,Grace Kean,grace.kean@exblog.jp,New,Web,1046,"Duis aliquam convallis nunc. Proin at turpis a pede posuere nonummy. Integer non velit. Donec diam neque, vestibulum eget, vulputate ut, ultrices vel, augue. Vestibulum ante ipsum primis in faucibus orci luctus et ultrices posuere cubilia Curae; Donec pharetra, magna vestibulum aliquet ultrices, erat tortor sollicitudin mi, sit amet lobortis sapien sapien non mi. Integer ac neque. Duis bibendum."
Leoline,Waghorne,jugem.jp,227,DabZ,Leoline Waghorne,leoline.waghorne@jugem.jp,Lost,Web,1031,"Nam dui. Proin leo odio, porttitor id, consequat in, consequat ut, nulla. Sed accumsan felis. Ut at dolor quis odio consequat varius. Integer ac leo."
Bram,Haglington,flickr.com,228,Rhybox,Bram Haglington,bram.haglington@flickr.com,New,Event,1039,"Donec posuere metus vitae ipsum. Aliquam non mauris. Morbi non lectus. Aliquam sit amet diam in magna bibendum imperdiet. Nullam orci pede, venenatis non, sodales sed, tincidunt eu, felis. Fusce posuere felis sed lacus. Morbi sem mauris, laoreet ut, rhoncus aliquet, pulvinar sed, nisl. Nunc rhoncus dui vel sem. Sed sagittis."
Hadrian,Dunkerly,mapy.cz,229,Realmix,Hadrian Dunkerly,hadrian.dunkerly@mapy.cz,New,Referral,1002,"Duis bibendum. Morbi non quam nec dui luctus rutrum. Nulla tellus. In sagittis dui vel nisl. Duis ac nibh. Fusce lacus purus, aliquet at, feugiat non, pretium quis, lectus. Suspendisse potenti. In eleifend quam a odio."
Fania,Nyland,blogtalkradio.com,230,Twinte,Fania Nyland,fania.nyland@blogtalkradio.com,Contacted,Web,1048,"Donec odio justo, sollicitudin ut, suscipit a, feugiat et, eros. Vestibulum ac est lacinia nisi venenatis tristique. Fusce congue, diam id ornare imperdiet, sapien urna pretium nisl, ut volutpat sapien arcu sed augue. Aliquam erat volutpat. In congue. Etiam justo. Etiam pretium iaculis justo."
Zia,Huntly,google.fr,231,Trupe,Zia Huntly,zia.huntly@google.fr,Contacted,Web,1005,"Nulla tellus. In sagittis dui vel nisl. Duis ac nibh. Fusce lacus purus, aliquet at, feugiat non, pretium quis, lectus. Suspendisse potenti. In eleifend quam a odio."
Aryn,Lineham,abc.net.au,232,Jabberstorm,Aryn Lineham,aryn.lineham@abc.net.au,Won,Referral,1031,Quisque id justo sit amet sapien dignissim vestibulum. Vestibulum ante ipsum primis in faucibus orci luctus et ultrices posuere cubilia Curae; Nulla dapibus dolor vel est.
Alla,Belderfield,ihg.com,233,Katz,Alla Belderfield,alla.belderfield@ihg.com,Lost,Event,1045,"Quisque erat eros, viverra eget, congue eget, semper rutrum, nulla. Nunc purus. Phasellus in felis. Donec semper sapien a libero. Nam dui."
Laurel,Smittoune,networksolutions.com,234,Dabjam,Laurel Smittoune,laurel.smittoune@networksolutions.com,Lost,Referral,1004,"Fusce congue, diam id ornare imperdiet, sapien urna pretium nisl, ut volutpat sapien arcu sed augue. Aliquam erat volutpat. In congue. Etiam justo."
Cilka,Spiller,springer.com,235,Centizu,Cilka Spiller,cilka.spiller@springer.com,Lost,Web,1003,"Praesent blandit lacinia erat. Vestibulum sed magna at nunc commodo placerat. Praesent blandit. Nam nulla. Integer pede justo, lacinia eget, tincidunt eget, tempus vel, pede. Morbi porttitor lorem id ligula. Suspendisse ornare consequat lectus. In est risus, auctor sed, tristique in, tempus sit amet, sem. Fusce consequat."
Claire,Baroc,issuu.com,236,Flashdog,Claire Baroc,claire.baroc@issuu.com,Contacted,Referral,1030,In hac habitasse platea dictumst.
Shir,Abela,simplemachines.org,237,Browsebug,Shir Abela,shir.abela@simplemachines.org,New,Web,1020,"Nulla ut erat id mauris vulputate elementum. Nullam varius. Nulla facilisi. Cras non velit nec nisi vulputate nonummy. Maecenas tincidunt lacus at velit. Vivamus vel nulla eget eros elementum pellentesque. Quisque porta volutpat erat. Quisque erat eros, viverra eget, congue eget, semper rutrum, nulla. Nunc purus."
Livvy,Bachelar,blog.com,238,Devshare,Livvy Bachelar,livvy.bachelar@blog.com,New,Event,1022,Etiam faucibus cursus urna. Ut tellus. Nulla ut erat id mauris vulputate elementum. Nullam varius. Nulla facilisi. Cras non velit nec nisi vulputate nonummy. Maecenas tincidunt lacus at velit.
Wernher,Schiesterl,hhs.gov,239,Photospace,Wernher Schiesterl,wernher.schiesterl@hhs.gov,Lost,Email Campaign,1042,Nullam sit amet turpis elementum ligula vehicula consequat. Morbi a ipsum. Integer a nibh. In quis justo. Maecenas rhoncus aliquam lacus. Morbi quis tortor id nulla ultrices aliquet.
Angelo,Wethey,google.nl,240,Feedfire,Angelo Wethey,angelo.wethey@google.nl,Contacted,LinkedIn,1016,"Donec ut mauris eget massa tempor convallis. Nulla neque libero, convallis eget, eleifend luctus, ultricies eu, nibh. Quisque id justo sit amet sapien dignissim vestibulum. Vestibulum ante ipsum primis in faucibus orci luctus et ultrices posuere cubilia Curae; Nulla dapibus dolor vel est. Donec odio justo, sollicitudin ut, suscipit a, feugiat et, eros. Vestibulum ac est lacinia nisi venenatis tristique. Fusce congue, diam id ornare imperdiet, sapien urna pretium nisl, ut volutpat sapien arcu sed augue. Aliquam erat volutpat. In congue."
Syman,Liddington,businessweek.com,241,Roomm,Syman Liddington,syman.liddington@businessweek.com,Contacted,Referral,1034,"Proin risus. Praesent lectus. Vestibulum quam sapien, varius ut, blandit non, interdum in, ante. Vestibulum ante ipsum primis in faucibus orci luctus et ultrices posuere cubilia Curae; Duis faucibus accumsan odio. Curabitur convallis. Duis consequat dui nec nisi volutpat eleifend. Donec ut dolor."
Helene,Josefsohn,dedecms.com,242,Yotz,Helene Josefsohn,helene.josefsohn@dedecms.com,Contacted,LinkedIn,1047,"Phasellus sit amet erat. Nulla tempus. Vivamus in felis eu sapien cursus vestibulum. Proin eu mi. Nulla ac enim. In tempor, turpis nec euismod scelerisque, quam turpis adipiscing lorem, vitae mattis nibh ligula nec sem."
Lorilee,Sole,weather.com,243,Pixope,Lorilee Sole,lorilee.sole@weather.com,Lost,Web,1005,"Nulla nisl. Nunc nisl. Duis bibendum, felis sed interdum venenatis, turpis enim blandit mi, in porttitor pede justo eu massa."
Laurianne,Haggish,gnu.org,244,Innotype,Laurianne Haggish,laurianne.haggish@gnu.org,Contacted,Email Campaign,1028,"Maecenas pulvinar lobortis est. Phasellus sit amet erat. Nulla tempus. Vivamus in felis eu sapien cursus vestibulum. Proin eu mi. Nulla ac enim. In tempor, turpis nec euismod scelerisque, quam turpis adipiscing lorem, vitae mattis nibh ligula nec sem. Duis aliquam convallis nunc."
Dalila,Egginton,t.co,245,Divanoodle,Dalila Egginton,dalila.egginton@t.co,Won,Referral,1050,"Nunc rhoncus dui vel sem. Sed sagittis. Nam congue, risus semper porta volutpat, quam pede lobortis ligula, sit amet eleifend pede libero quis orci. Nullam molestie nibh in lectus. Pellentesque at nulla."
Carlita,O'Flaverty,jiathis.com,246,Zoomcast,Carlita O'Flaverty,carlita.o'flaverty@jiathis.com,Lost,Referral,1021,Praesent id massa id nisl venenatis lacinia. Aenean sit amet justo.
Zorana,Hamberston,stumbleupon.com,247,Bluezoom,Zorana Hamberston,zorana.hamberston@stumbleupon.com,Lost,Event,1040,"Fusce posuere felis sed lacus. Morbi sem mauris, laoreet ut, rhoncus aliquet, pulvinar sed, nisl. Nunc rhoncus dui vel sem. Sed sagittis. Nam congue, risus semper porta volutpat, quam pede lobortis ligula, sit amet eleifend pede libero quis orci. Nullam molestie nibh in lectus. Pellentesque at nulla. Suspendisse potenti. Cras in purus eu magna vulputate luctus. Cum sociis natoque penatibus et magnis dis parturient montes, nascetur ridiculus mus."
Nolan,Windaybank,imageshack.us,248,Browsezoom,Nolan Windaybank,nolan.windaybank@imageshack.us,Lost,LinkedIn,1028,"Curabitur in libero ut massa volutpat convallis. Morbi odio odio, elementum eu, interdum eu, tincidunt in, leo. Maecenas pulvinar lobortis est. Phasellus sit amet erat. Nulla tempus. Vivamus in felis eu sapien cursus vestibulum. Proin eu mi."
Alicia,Burchmore,chron.com,249,Plajo,Alicia Burchmore,alicia.burchmore@chron.com,Won,Email Campaign,1048,"Donec odio justo, sollicitudin ut, suscipit a, feugiat et, eros. Vestibulum ac est lacinia nisi venenatis tristique. Fusce congue, diam id ornare imperdiet, sapien urna pretium nisl, ut volutpat sapien arcu sed augue. Aliquam erat volutpat. In congue."
